80,Délits sur la route : qu'en est-il depuis 2018 ?,Infos Carte Grise,delits-sur-la-route-quen-est-il-depuis-2018,"<h2 style=""margin-left:0cm; margin-right:0cm; text-align:justify""><span style=""font-size:11pt""><span style=""font-family:Calibri,sans-serif""><strong><span style=""font-size:12.0pt""><span style=""font-family:&quot;Times New Roman&quot;,&quot;serif&quot;"">D&eacute;lits routiers&nbsp;: l&rsquo;une des causes des confiscations de v&eacute;hicules</span></span></strong></span></span></h2>

<p style=""margin-left:0cm; margin-right:0cm; text-align:justify""><span style=""font-size:11pt""><span style=""font-family:Calibri,sans-serif""><span style=""font-size:12.0pt""><span style=""font-family:&quot;Times New Roman&quot;,&quot;serif&quot;"">En cas de d&eacute;lit grave, la saisie des voitures est une lourde sanction pour l&rsquo;usager. En effet, une immobilisation d&rsquo;un v&eacute;hicule peut emmener &agrave; une confiscation d&eacute;finitive &agrave; la suite d&rsquo;infractions ou de d&eacute;lits routiers. Il est &agrave; noter qu&rsquo;une partie du parc automobile de la gendarmerie est compos&eacute;e des v&eacute;hicules saisis des particuliers. L&rsquo;attribution du v&eacute;hicule aux forces de l&rsquo;ordre intervient, en particulier dans des affaires &eacute;conomiques et financi&egrave;res telles que des blanchiments d&rsquo;argent, escroquerie, travail ill&eacute;gal, mais aussi des affaires criminelles comme le grand banditisme, les trafics et bien d&rsquo;autres. </span></span></span></span></p>

<p style=""margin-left:0cm; margin-right:0cm; text-align:justify""><span style=""font-size:11pt""><span style=""font-family:Calibri,sans-serif""><span style=""font-size:12.0pt""><span style=""font-family:&quot;Times New Roman&quot;,&quot;serif&quot;"">Selon l&rsquo;estimation fournie par la gendarmerie, pr&egrave;s de 40% des 1&nbsp;150 v&eacute;hicules saisis par la gendarmerie en d&eacute;but d&rsquo;ann&eacute;e 2018 provenaient des d&eacute;lits routiers. </span></span></span></span></p>

<figure class=""easyimage my-custom-full-class""><img alt=""une partie du parc automobile de la gendarmerie est composée des véhicules saisis des particuliers."" src=""blob:http://blog.cgofficiel.fr/da44e31f-a966-41a8-be3d-b42fb2e6532d"" width=""1181"" />
<figcaption></figcaption>
</figure>

<h2 style=""margin-left:0cm; margin-right:0cm; text-align:justify""><span style=""font-size:11pt""><span style=""font-family:Calibri,sans-serif""><strong><span style=""font-size:12.0pt""><span style=""font-family:&quot;Times New Roman&quot;,&quot;serif&quot;"">Confiscations de v&eacute;hicules&nbsp;: attention aux d&eacute;lits routiers</span></span></strong></span></span></h2>

<p style=""margin-left:0cm; margin-right:0cm; text-align:justify""><span style=""font-size:11pt""><span style=""font-family:Calibri,sans-serif""><span style=""font-size:12.0pt""><span style=""font-family:&quot;Times New Roman&quot;,&quot;serif&quot;"">La Loi d&#39;orientation et de programmation pour la performance de la s&eacute;curit&eacute; int&eacute;rieure dite Loppsi 2 a automatis&eacute; l&rsquo;immobilisation des v&eacute;hicules depuis 2011. En th&eacute;orie, cette sanction s&rsquo;applique d&rsquo;office en cas de d&eacute;lit routier tels que le d&eacute;lit de fuite, l&rsquo;exc&egrave;s de vitesse, la conduite sans permis, etc.&nbsp;</span></span></span></span></p>

<p style=""margin-left:0cm; margin-right:0cm; text-align:justify""><span style=""font-size:11pt""><span style=""font-family:Calibri,sans-serif""><span style=""font-size:12.0pt""><span style=""font-family:&quot;Times New Roman&quot;,&quot;serif&quot;"">D&rsquo;une fa&ccedil;on g&eacute;n&eacute;rale, l&rsquo;immobilisation s&rsquo;applique &agrave; tous les d&eacute;lits punis d&rsquo;une peine d&rsquo;emprisonnement d&rsquo;un an minimum. En revanche, pour que la sanction s&rsquo;applique, il faut que le fautif soit le propri&eacute;taire et que le v&eacute;hicule ait servi &agrave; commettre la faute. Il est &agrave; noter que si le juge d&eacute;cide de ne pas appliquer la confiscation de la voiture, il doit en motiver la raison.</span></span></span></span></p>

<p style=""margin-left:0cm; margin-right:0cm; text-align:justify""><strong><span style=""font-size:11pt""><span style=""font-family:Calibri,sans-serif""><span style=""font-size:12.0pt""><span style=""font-family:&quot;Times New Roman&quot;,&quot;serif&quot;"">Cette loi est encore renforc&eacute;e par l&rsquo;article 98 de la loi pr&eacute;cisant que les forces de l&rsquo;ordre peuvent utiliser les v&eacute;hicules confisqu&eacute;s&hellip; avant tout jugement. </span></span></span></span></strong></p>

<p style=""margin-left:0cm; margin-right:0cm; text-align:justify""><span style=""font-size:11pt""><span style=""font-family:Calibri,sans-serif""><span style=""font-size:12.0pt""><span style=""font-family:&quot;Times New Roman&quot;,&quot;serif&quot;"">Selon Me Frank Samson, la proc&eacute;dure de confiscation d&rsquo;un v&eacute;hicule est longue et complexe. En effet, selon toujours Me Frank Samson, cette sanction concerne principalement les v&eacute;hicules hors norme, c&rsquo;est-&agrave;-dire, des voitures impliqu&eacute;es dans de tr&egrave;s grand exc&egrave;s de vitesse, ou appartenant &agrave; des conducteurs au casier d&eacute;j&agrave; bien rempli. L&rsquo;utilisation des v&eacute;hicules saisis par les forces de l&rsquo;ordre avant qu&rsquo;un jugement soit rendu est plus que la limite.</span></span></span></span></p>

<p style=""margin-left:0cm; margin-right:0cm; text-align:justify""><strong><span style=""font-size:11pt""><span style=""font-family:Calibri,sans-serif""><span style=""font-size:12.0pt""><span style=""font-family:&quot;Times New Roman&quot;,&quot;serif&quot;"">Les gendarmes et policiers n&rsquo;ont pas souhait&eacute; fournir de chiffres concernant le nombre des voitures saisis, cependant, elles repr&eacute;sentent environ 5% du parc automobile des forces de l&rsquo;ordre.</span></span></span></span></strong></p>

<p style=""margin-left:0cm; margin-right:0cm; text-align:justify""><span style=""font-size:11pt""><span style=""font-family:Calibri,sans-serif""><span style=""font-size:12.0pt""><span style=""font-family:&quot;Times New Roman&quot;,&quot;serif&quot;"">Par ailleurs, d&rsquo;apr&egrave;s la gendarmerie, la moiti&eacute; des v&eacute;hicules saisis sont li&eacute;s &agrave; une conduite sous l&rsquo;emprise de l&rsquo;alcool ou de stup&eacute;fiants, un quart provient des r&eacute;cidives de grands exc&egrave;s de vitesse. Et enfin, le reste provient d&rsquo;une conduite sans permis, d&rsquo;une mise en danger de la vie d&rsquo;autrui ou encore d&rsquo;un d&eacute;lit de fuite.</span></span></span></span></p>

<p style=""margin-left:0cm; margin-right:0cm; text-align:justify""><span style=""font-size:11pt""><span style=""font-family:Calibri,sans-serif""><span style=""font-size:12.0pt""><span style=""font-family:&quot;Times New Roman&quot;,&quot;serif&quot;"">La plupart de nous pensent que les v&eacute;hicules saisis sont des bolides, pourtant environ 20% du parc sont des Renault, 15% de Peugeot et 10% de Citro&euml;n. On y trouve &eacute;galement un panel de berlines allemandes, de gros 4x4 ainsi qu&rsquo;une poign&eacute;e de voitures sportives. Seulement 8% du parc est compos&eacute; de deux roues.</span></span></span></span></p>","Selon la gendarmerie, près de 40% des 1 150 véhicules saisis en début d’année 2018 provenaient des délits routiers.",2019-01-26 16:10:00,1,2019-02-13 16:11:22,8a193d67e9b2349142aba9ca8997f60b.jpeg
81,Pollution : des véhicules neufs qui pollueraient plus ?,Infos Carte Grise,pollution-des-vehicules-neufs-qui-pollueraient-plus,"<h2 style=""margin-left:0cm; margin-right:0cm; text-align:justify""><span style=""font-size:11pt""><strong><span style=""font-size:12.0pt"">Voitures neuves : une hausse des &eacute;missions de CO2 depuis 2018</span></strong></span></h2>

<p style=""margin-left:0cm; margin-right:0cm; text-align:justify""><span style=""font-size:11pt""><span style=""font-size:12.0pt"">En 2018, les voitures neuves ont &eacute;mis plus de CO2 qu&rsquo;en 2017. En effet, selon le <strong>Comit&eacute; des constructeurs fran&ccedil;ais d&rsquo;automobiles</strong>, les &eacute;missions de CO2 des voitures neuves vendues sont en hausse de 1 % en 2018, soit pr&egrave;s de 112 grammes de CO2 par kilom&egrave;tre parcouru. Ce chiffre peut surprendre, en particulier dans un contexte environnemental o&ugrave; les gouvernements successifs ont mis en place divers dispositifs afin de limiter toute hausse d&#39;&eacute;mission&nbsp;de CO2 des voitures neuves en France. </span></span></p>

<hr />
<h2 style=""margin-left:0cm; margin-right:0cm; text-align:justify""><span style=""font-size:11pt""><strong><span style=""font-size:12.0pt"">Hausse des &eacute;missions de CO2&nbsp;: quels sont les causes&nbsp;? </span></strong></span></h2>

<p style=""margin-left:0cm; margin-right:0cm; text-align:justify""><span style=""font-size:11pt""><span style=""font-size:12.0pt"">L&rsquo;une des explications concernant cette hausse est le d&eacute;samour des fran&ccedil;ais pour les v&eacute;hicules diesel. En effet, depuis quelques ann&eacute;es, les ventes des v&eacute;hicules &agrave; moteur diesel sont en chute libre, -15% sur le march&eacute; fran&ccedil;ais en 2018. Pourtant, les voitures &agrave; essence consomment plus, par cons&eacute;quence, elles &eacute;mettraient plus de CO2. </span></span></p>

<p style=""margin-left:0cm; margin-right:0cm; text-align:justify""><span style=""font-size:11pt""><span style=""font-size:12.0pt"">L&rsquo;autre cause est le succ&egrave;s grandissant des SUV aupr&egrave;s des particuliers. En effet, ces v&eacute;hicules bicorps gagnent des parts de march&eacute;. D&eacute;sormais, ils repr&eacute;sentent plus du tiers des v&eacute;hicules vendus. Pourtant, les SUV &eacute;mettent plus de CO2, aussi bien en essence qu&rsquo;en diesel. </span></span></p>

<p style=""margin-left:0cm; margin-right:0cm; text-align:justify""><span style=""font-size:11pt""><span style=""font-size:12.0pt"">En effet, plus hautes que les citadines compactes classiques, les SUV ont un a&eacute;rodynamisme moins favorable que les citadines, elles consomment donc plus de carburant et &eacute;mettent plus de dioxyde de carbone. Si les SUV repr&eacute;sentaient 6% du part des march&eacute;s fran&ccedil;ais en 2007, ils repr&eacute;sentent aujourd&rsquo;hui de 32% sur le march&eacute;.</span></span></p>

<p style=""margin-left:0cm; margin-right:0cm; text-align:justify""><strong><span style=""font-size:11pt""><span style=""font-size:12.0pt"">Par ailleurs, le march&eacute; des voitures &eacute;lectriques ne d&eacute;colle pas encore. En effet, seuls 31&nbsp;059 v&eacute;hicules &eacute;lectriques sont vendus en 2018, soit 1,43% du part de march&eacute;. De ce fait, les ventes de voitures dites &quot;propres&quot; ne contribuent pas encore &agrave; inverser la tendance. </span></span></strong></p>","Seuls 31 059 véhicules électriques sont vendus en 2018, soit 1,43% du part de marché.",2019-02-13 16:16:00,1,2019-02-26 14:28:47,691948da155535b22ec0df19b0dda15d.jpeg
82,Pollution Diesel au 1er janvier : flyer d'information,Infos Carte Grise,pollution-diesel-au-1er-janvier-flyer-dinformation,"<p>Pour expliquer aux automobilistes les changements &agrave; venir, le CNPA a r&eacute;alis&eacute; un petit document qui r&eacute;pond &agrave; trois questions essentielles : quand, pourquoi, comment.</p>

<p>Ce flyer, intitul&eacute; <strong>Tout comprendre sur l&rsquo;am&eacute;lioration du contr&ocirc;le pollution des v&eacute;hicules Diesel </strong>explique &eacute;galement d&#39;o&ugrave; vient cette r&eacute;forme, l&#39;impact pr&eacute;vsionnel sur les taux de contre-visite pollution des v&eacute;hiucles Diesel, et d&eacute;livre des conseils pour appr&eacute;hender sereinement cette &eacute;volution r&eacute;glementaire.</p>

<p>Le document rappelle &eacute;galement un message essentiel : Quel que soit son &acirc;ge, un v&eacute;hicule r&eacute;guli&egrave;rement entretenu par un professionnel de l&rsquo;automobile, passera sans souci au contr&ocirc;le technique !</p>

<p>Cet entretien r&eacute;gulier assure ainsi fiabilit&eacute;, bonne performance et long&eacute;vit&eacute; des v&eacute;hicules. En cours de production, il sera prochainement disponible aupr&egrave;s de vos interlocuteurs locaux CNPA. En attendant, vous pouvez le t&eacute;l&eacute;charger ci-dessous. Nous vous recommandons de l&#39;imprimer en recto-verso, au format A5.</p>

<figure class=""easyimage my-custom-full-class""><img alt="""" src=""blob:http://blog.cgofficiel.fr/9596cb04-a965-48d9-8253-4608806b2f5b"" width=""1024"" />
<figcaption></figcaption>
</figure>

<p>&nbsp;</p>","Pour expliquer aux automobilistes les changements à venir, le CNPA a réalisé un petit document qui répond à trois questions essentielles : quand, pourquoi,",2019-02-20 16:08:00,1,2019-02-28 11:18:07,6d0f7ebc6c0ccb886c010143440356c8.jpeg
86,ckfinder test,Lorenzo R.,ckfinder-test,"<p><img alt="""" src=""/userfiles/images/adi-goldstein-717512-unsplash.jpg"" style=""height:133px; width:200px"" />rerererer</p>",rere,2019-03-01 16:52:00,1,2019-03-01 16:55:05,69a23b0aa4bccf4275f9dacd67b137ef.jpeg
87,Vente de voiture électrique : où en sont les ventes ?,Infos Carte Grise,vente-de-voiture-electrique-ou-en-sont-les-ventes,"<h2 style=""text-align:justify""><span style=""font-size:11pt""><span style=""font-family:Calibri,sans-serif""><strong><span style=""font-size:12.0pt""><span style=""font-family:&quot;Times New Roman&quot;,&quot;serif&quot;"">Voiture &eacute;lectrique&nbsp;: une vente &agrave; la hausse vers depuis fin 2018</span></span></strong></span></span></h2>

<p style=""text-align:justify""><span style=""font-size:11pt""><span style=""font-family:Calibri,sans-serif""><span style=""font-size:12.0pt""><span style=""font-family:&quot;Times New Roman&quot;,&quot;serif&quot;"">Certes la vente des voitures &eacute;lectriques ne repr&eacute;sente m&ecirc;me pas 1,5% du part du march&eacute; automobile, toutefois elle est en hausse en France avec 31.059 exemplaires vendus en 2018. En effet, par rapport &agrave; la vente en 2017, le march&eacute; des v&eacute;hicules &eacute;lectriques est &agrave; la hausse de 25%.&nbsp; Sur le dernier trimestre, la vente &eacute;tait excellente. Une ann&eacute;e 2018 cl&ocirc;tur&eacute;e par un mois de d&eacute;cembre record avec une vente repr&eacute;sentant 2,7% des immatriculations globales. En France, les voitures z&eacute;ro &eacute;missions n&rsquo;arrivent pas encore &agrave; s&eacute;duire beaucoup d&rsquo;adeptes m&ecirc;me si elles sont en l&eacute;g&egrave;re hausse, par rapport &agrave; la Norv&egrave;ge o&ugrave; un tiers des voitures vendues en 2018 &eacute;tait des voitures 100% &eacute;lectriques.</span></span></span></span></p>

<hr />
<h2 style=""text-align:justify""><span style=""font-size:11pt""><span style=""font-family:Calibri,sans-serif""><strong><span style=""font-size:12.0pt""><span style=""font-family:&quot;Times New Roman&quot;,&quot;serif&quot;"">Quels sont les mod&egrave;les &eacute;lectriques les plus vendus en 2018&nbsp;?</span></span></strong></span></span></h2>

<p style=""text-align:justify""><span style=""font-size:11pt""><span style=""font-family:Calibri,sans-serif""><span style=""font-size:12.0pt""><span style=""font-family:&quot;Times New Roman&quot;,&quot;serif&quot;"">Dans le classement des meilleures ventes en 2018, la Renault Zo&eacute; et la Nissan Leaf conservent les deux premi&egrave;res places, avec respectivement 17.038 et 4.572 immatriculations. Le tandem Kia Soul et Citro&euml;n C-Z&eacute;ro donne &eacute;galement un joli coup de pouce au march&eacute; des v&eacute;hicules &eacute;lectriques, avec respectivement 660 et 746 exemplaires &eacute;coul&eacute;s.</span></span></span></span></p>

<p style=""text-align:justify""><span style=""font-size:11pt""><span style=""font-family:Calibri,sans-serif""><span style=""font-size:12.0pt""><span style=""font-family:&quot;Times New Roman&quot;,&quot;serif&quot;"">Par contre, la vente du Mod&egrave;le X du constructeur californien Tesla Motors a chut&eacute; de 0,6% en 2018, avec 503 mod&egrave;les vendus. La vente des Volkswagen Up, Citro&euml;n e-Mehari et Nissan E-NV200 a &eacute;galement baiss&eacute;, avec respectivement - 7,1%, - 12,3% et - 40,9%. Quant aux nouveaux entrants, Kia e-Niro, 205 exemplaires ont &eacute;t&eacute; vendus l&rsquo;ann&eacute;e derni&egrave;re. </span></span></span></span></p>

<p style=""text-align:justify""><span style=""font-size:11pt""><span style=""font-family:Calibri,sans-serif""><span style=""font-size:12.0pt""><span style=""font-family:&quot;Times New Roman&quot;,&quot;serif&quot;"">En somme, la voiture &eacute;lectrique cumule 31.059 immatriculations en 2018, la Renault Zo&eacute; repr&eacute;sentant plus de 50 % des ventes.</span></span></span></span></p>","Dans le classement des meilleures ventes en 2018, la Renault Zoé et la Nissan Leaf conservent les deux premières places, avec respectivement 17.038 et 4.57",2019-02-06 13:51:00,1,2019-03-06 13:51:35,0d91f11c85ddb77255bfd8ef40df39ec.jpeg
88,80 km/h sur les routes : le bilan,Infos Carte Grise,80-km-h-sur-les-routes-le-bilan,"<h2 style=""text-align:justify""><span style=""font-size:11pt""><span style=""font-family:Calibri,sans-serif""><strong><span style=""font-size:12.0pt""><span style=""font-family:&quot;Times New Roman&quot;,&quot;serif&quot;"">Mortalit&eacute; en baisse&nbsp;: les 80 km/h toujours sur la sellette</span></span></strong></span></span></h2>

<p style=""text-align:justify""><span style=""font-size:11pt""><span style=""font-family:Calibri,sans-serif""><span style=""font-size:12.0pt""><span style=""font-family:&quot;Times New Roman&quot;,&quot;serif&quot;"">Les 80 km/h sont entr&eacute;s en vigueur depuis le 1er juillet 2018 sur de routes secondaires. Malgr&eacute; son impact positif sur l&rsquo;environnement et la baisse des morts sur la route, le Pr&eacute;sident de la r&eacute;publique Emmanuel Macron pourrait d&eacute;cider de revenir sur cette mesure afin d&#39;apaiser la col&egrave;re des &quot;gilets jaunes&quot;.</span></span></span></span></p>

<p style=""text-align:justify""><span style=""font-size:11pt""><span style=""font-family:Calibri,sans-serif""><span style=""font-size:12.0pt""><span style=""font-family:&quot;Times New Roman&quot;,&quot;serif&quot;"">En effet, en 2018, la mortalit&eacute; sur les routes fran&ccedil;aises affiche un recul historique. 3 259 personnes sont mortes sur les routes de France ce qui fait neuf de moins que le pr&eacute;c&eacute;dent &quot;record&quot; enregistr&eacute; en 2013, a annonc&eacute; le Premier ministre &Eacute;douard Philippe le 28 janvier 2019. Mais cette mesure est tr&egrave;s contest&eacute;e, particuli&egrave;rement dans les zones rurales.</span></span></span></span></p>

<p style=""text-align:justify""><span style=""font-size:11pt""><span style=""font-family:Calibri,sans-serif""><span style=""font-size:12.0pt""><span style=""font-family:&quot;Times New Roman&quot;,&quot;serif&quot;"">Le Pr&eacute;sident de la r&eacute;publique Emmanuel Macron pourrait abandonner cette mesure qu&rsquo;il reconnait comme une &laquo;&nbsp;connerie&nbsp;&raquo;, selon des propos rapport&eacute;s par Arnaud P&eacute;ricard, maire de Saint-Germain-en-Laye. En revanche, le Premier ministre continue de d&eacute;fendre cette mesure, toutefois il a jug&eacute; l&eacute;gitime de discuter dans le cadre du grand d&eacute;bat national. </span></span></span></span></p>

<p style=""text-align:justify""><span style=""font-size:11pt""><span style=""font-family:Calibri,sans-serif""><span style=""font-size:12.0pt""><span style=""font-family:&quot;Times New Roman&quot;,&quot;serif&quot;"">Par ailleurs, le Pr&eacute;sident pourrait donc abandonner d&eacute;finitivement la mesure de 80 km/h ou laisser aux maires le choix de l&rsquo;appliquer ou non. Afin de calmer les m&eacute;contentements des gilets jaunes, le gouvernement envisage la cr&eacute;ation d&#39;une prime mobilit&eacute;. C&rsquo;est le Ministre du travail, Muriel P&eacute;nicaud, qui a &eacute;voqu&eacute; cette nouvelle mesure. Cette prime serait vers&eacute;e aux &quot;sept Fran&ccedil;ais sur dix qui se rendent &agrave; leur travail en voiture&quot; d&egrave;s 2019.</span></span></span></span></p>","Les 80 km/h sont entrés en vigueur depuis le 1er juillet 2018 sur de routes secondaires. Cette mesure est contestée, surtout en zones rurales.",2019-03-06 13:55:38,1,NULL,093bacce4f673b17de4522b3a9d9236d.jpeg
89,Péages urbains : ce qui aurait dû se passer,Infos Carte Grise,peages-urbains-ce-qui-aurait-du-se-passer,"<h2 style=""text-align:justify""><span style=""font-size:11pt""><span style=""font-family:Calibri,sans-serif""><strong><span style=""font-size:12.0pt""><span style=""font-family:&quot;Times New Roman&quot;,&quot;serif&quot;"">P&eacute;ages urbains&nbsp;: une mesure abandonn&eacute;e par le gouvernement</span></span></strong></span></span></h2>

<p style=""text-align:justify""><span style=""font-size:11pt""><span style=""font-family:Calibri,sans-serif""><span style=""font-size:12.0pt""><span style=""font-family:&quot;Times New Roman&quot;,&quot;serif&quot;"">Le gouvernement a d&eacute;cid&eacute; de renoncer aux p&eacute;ages urbains afin d&rsquo;&eacute;viter de renforcer les mouvements de gilets jaunes. En effet, cette mesure a &eacute;t&eacute; retir&eacute; du projet de loi d&rsquo;orientation sur les mobilit&eacute;s.</span></span></span></span></p>

<p style=""text-align:justify""><span style=""font-size:11pt""><span style=""font-family:Calibri,sans-serif""><span style=""font-size:12.0pt""><span style=""font-family:&quot;Times New Roman&quot;,&quot;serif&quot;"">Cette mesure avait pour but d&rsquo;autoriser les communes de plus de 100.000 habitants, &agrave;&nbsp;l&rsquo;installation d&rsquo;un p&eacute;age &agrave; l&#39;entr&eacute;e de leurs centres-villes dans le but de limiter la circulation automobile dans les centres urbains et de r&eacute;duire ainsi les nuisances environnementales, particuli&egrave;rement la pollution de l&rsquo;air.</span></span></span></span></p>

<p style=""text-align:justify""><span style=""font-size:11pt""><span style=""font-family:Calibri,sans-serif""><span style=""font-size:12.0pt""><span style=""font-family:&quot;Times New Roman&quot;,&quot;serif&quot;"">Cette mesure a &eacute;t&eacute; d&eacute;j&agrave; pr&eacute;vu depuis le Grenelle de l&rsquo;environnement de 2007, cependant le gouvernement rendre enfin op&eacute;rationnel en novembre dernier. Face aux r&eacute;ticences de nombreuses m&eacute;tropoles, le gouvernement a finalement abandonn&eacute; cette mesure. En effet, la maire de Paris, Anne Hidalgo la jugeait comme discriminatoire pour les m&eacute;nages &agrave; faibles revenus. D&rsquo;ailleurs, une telle mesure pourrait &laquo;&nbsp;accentuer les fractures entre territoires&nbsp;&raquo;, selon e minist&egrave;re des Transports.</span></span></span></span></p>

<p style=""text-align:justify""><span style=""font-size:11pt""><span style=""font-family:Calibri,sans-serif""><span style=""font-size:12.0pt""><span style=""font-family:&quot;Times New Roman&quot;,&quot;serif&quot;"">En revanche, l&#39;instauration de &quot;zones &agrave; faibles &eacute;missions&quot; reste toujours d&rsquo;actualit&eacute;. Elle fait toujours partie du projet de loi.</span></span></span></span></p>

<p style=""text-align:justify""><span style=""font-size:11pt""><span style=""font-family:Calibri,sans-serif""><span style=""font-size:12.0pt""><span style=""font-family:&quot;Times New Roman&quot;,&quot;serif&quot;"">Par ailleurs, la cr&eacute;ation de la vignette poids lourd reste en suspension. L&rsquo;Etat aurait d&eacute;cid&eacute; de reporter l&rsquo;annonce de sa d&eacute;cision. &nbsp;</span></span></span></span></p>",Cette mesure a pour but d’autoriser les communes de plus de 100.000 habitants  à l’installation d’un péage à l'entrée de leurs centres-villes dans le but,2019-03-06 13:59:26,1,NULL,940b9c2a42c99bc35fe7327c73bb9b1f.jpeg
