1,Titre de l'article 1,Benoit C.,titre-de-larticle-1,"<h2>sous titre n&deg;1</h2>

<p>Alios autem dicere aiunt multo etiam inhumanius (quem locum breviter paulo ante perstrinxi) praesidii adiumentique causa, non benevolentiae neque caritatis, amicitias esse expetendas; itaque, ut quisque minimum firmitatis haberet minimumque virium, ita amicitias appetere maxime; ex eo fieri ut mulierculae magis amicitiarum praesidia quaerant quam viri et inopes quam opulenti et calamitosi quam ii qui putentur beati.</p>

<h2>sous titre n&deg;2</h2>

<p>Alios autem dicere aiunt multo etiam inhumanius (quem locum breviter paulo ante perstrinxi) praesidii adiumentique causa, non benevolentiae neque caritatis, amicitias esse expetendas; itaque, ut quisque minimum firmitatis haberet minimumque virium, ita amicitias appetere maxime; ex eo fieri ut mulierculae magis amicitiarum praesidia quaerant quam viri et inopes quam opulenti et calamitosi quam ii qui putentur beati.</p>

<h2>sous titre n&deg;3</h2>

<p>Alios autem dicere aiunt multo etiam inhumanius (quem locum breviter paulo ante perstrinxi) praesidii adiumentique causa, non benevolentiae neque caritatis, amicitias esse expetendas; itaque, ut quisque minimum firmitatis haberet minimumque virium, ita amicitias appetere maxime; ex eo fieri ut mulierculae magis amicitiarum praesidia quaerant quam viri et inopes quam opulenti et calamitosi quam ii qui putentur beati.</p>",ex eo fieri ut mulierculae magis amicitiarum praesidia quaerant quam viri et inopes quam opulenti et calamitosi quam ii qui putentur beati.,2018-10-12 07:54:00,0,2018-10-12 09:07:00,“ ”
2,Titre de l'article 2,Fanny Lefore,titre-de-larticle-2,"<p>Alios autem dicere aiunt multo etiam inhumanius (quem locum breviter paulo ante perstrinxi) praesidii adiumentique causa, non benevolentiae neque caritatis, amicitias esse expetendas; itaque, ut quisque minimum firmitatis haberet minimumque virium, ita amicitias appetere maxime; ex eo fieri ut mulierculae magis amicitiarum praesidia quaerant quam viri et inopes quam opulenti et calamitosi quam ii qui putentur beati.</p>

<h2>In his tractibus navigerum nusquam</h2>

<p>Visitur flumen sed in locis plurimis aquae suapte natura calentes emergunt ad usus aptae multiplicium medelarum. verum has quoque regiones pari sorte Pompeius Iudaeis domitis et Hierosolymis captis in provinciae speciem delata iuris dictione formavit.</p>

<p>Nec vox accusatoris ulla licet subditicii in his malorum quaerebatur acervis ut saltem specie tenus crimina praescriptis legum committerentur, quod aliquotiens fecere principes saevi: sed quicquid Caesaris implacabilitati sedisset, id velut fas iusque perpensum confestim urgebatur impleri.</p>

<p>Quare talis improborum consensio non modo excusatione amicitiae tegenda non est sed potius supplicio omni vindicanda est, ut ne quis concessum putet amicum vel bellum patriae inferentem sequi; quod quidem, ut res ire coepit, haud scio an aliquando futurum sit. Mihi autem non minori curae est, qualis res publica post mortem meam futura, quam qualis hodie sit.</p>

<h2>Horum adventum praedocti speculationibus</h2>

<p>Fidis rectores militum tessera data sollemni armatos omnes celeri <a href=""https://www.faux-texte.com/lorem-ipsum-5.htm"" target=""_blank"">eduxere procursu</a> et agiliter praeterito Calycadni fluminis ponte, cuius undarum magnitudo murorum adluit turres, in speciem locavere pugnandi. neque tamen exiluit quisquam nec permissus est congredi. formidabatur enim flagrans vesania manus et superior numero et ruitura sine respectu salutis in ferrum.</p>","Calycadni fluminis ponte, cuius undarum magnitudo murorum adluit turres, in speciem locavere pugnandi. neque tamen exiluit quisquam nec permissus est congredi. formidabatur enim flagrans vesania manus",2018-10-12 09:11:11,0,NULL,56a398308dd7b52618b2e8073b58021d.jpeg
3,"Atque, ut Tullius ait, ut etiam ferae fame monitae plerumque ad",Fanny Lefore,atque-ut-tullius-ait-ut-etiam-ferae-fame-monitae-plerumque-ad,"<blockquote>
<p>Nec sane haec sola pernicies orientem diversis cladibus adfligebat. Namque et Isauri, quibus est usitatum saepe pacari saepeque inopinis excursibus cuncta miscere, ex latrociniis occultis et raris, alente inpunitate adulescentem in peius audaciam ad bella gravia proruperunt, diu quidem perduelles spiritus inrequietis motibus erigentes, hac tamen indignitate perciti vehementer, ut iactitabant, quod eorum capiti quidam consortes apud Iconium Pisidiae oppidum in amphitheatrali spectaculo feris praedatricibus obiecti sunt praeter morem.</p>
</blockquote>

<p>Atque, ut Tullius ait, ut etiam ferae fame monitae plerumque ad eum locum ubi aliquando pastae sunt revertuntur, ita homines instar turbinis degressi montibus impeditis et arduis loca petivere mari confinia, per quae viis latebrosis sese convallibusque occultantes cum appeterent noctes luna etiam tum cornuta ideoque nondum solido splendore fulgente nauticos observabant quos cum in somnum sentirent effusos per ancoralia, quadrupedo gradu repentes seseque suspensis passibus iniectantes in scaphas eisdem sensim nihil opinantibus adsistebant et incendente aviditate saevitiam ne cedentium quidem ulli parcendo obtruncatis omnibus merces opimas velut viles nullis repugnantibus avertebant. haecque non diu sunt perpetrata.</p>

<h2>Iamque lituis cladium concrepantibus internarum</h2>

<h3>non celate ut antea turbidum saeviebat</h3>

<p>ingenium a veri consideratione detortum et nullo inpositorum vel conpositorum fidem sollemniter inquirente nec discernente a societate noxiorum insontes velut exturbatum e iudiciis fas omne discessit, et causarum legitima silente defensione carnifex rapinarum sequester et obductio capitum et bonorum ubique multatio versabatur per orientales provincias, quas recensere puto nunc oportunum absque Mesopotamia digesta, cum bella Parthica dicerentur, et Aegypto, quam necessario aliud reieci ad tempus.</p>

<h3>Nec sane haec sola pernicies orientem</h3>

<p>diversis cladibus adfligebat. Namque et Isauri, quibus est usitatum saepe pacari saepeque inopinis excursibus cuncta miscere, ex latrociniis occultis et raris, alente inpunitate adulescentem in peius audaciam ad bella gravia proruperunt, diu quidem perduelles spiritus inrequietis motibus erigentes, hac tamen indignitate perciti vehementer, ut iactitabant, quod eorum capiti quidam consortes apud Iconium Pisidiae oppidum in amphitheatrali spectaculo feris praedatricibus obiecti sunt praeter morem.</p>

<h2>Haec subinde Constantius audiens et quaedam referente</h2>

<p>Thalassio doctus, quem eum odisse iam conpererat lege communi, scribens ad Caesarem blandius adiumenta paulatim illi subtraxit, sollicitari se simulans ne, uti est militare otium fere tumultuosum, in eius perniciem conspiraret, solisque scholis iussit esse contentum palatinis et protectorum cum Scutariis et Gentilibus, et mandabat Domitiano, ex comite largitionum, praefecto ut cum in Syriam venerit, Gallum, quem crebro acciverat, ad Italiam properare blande hortaretur et verecunde.</p>","Atque, ut Tullius ait, ut etiam ferae fame monitae plerumque ad eum locum ubi aliquando pastae sunt revertuntur, ita homines instar turbinis degressi montibus impeditis et arduis loca petivere mari confinia, per quae viis",2018-10-12 09:59:22,0,NULL,c5f7e858c190635171e38bc5a93e7135.jpeg
4,Générateur de texte aléatoire - Lorem Ipsum,Benoit C.,generateur-de-texte-aleatoire-lorem-ipsum,"<h2>Advenit post multos Scudilo Scutariorum tribunus</h2>

<p>velamento subagrestis ingenii persuasionis opifex callidus. qui eum adulabili sermone seriis admixto solus omnium proficisci pellexit vultu adsimulato saepius replicando quod flagrantibus votis eum videre frater cuperet patruelis, siquid per inprudentiam gestum est remissurus ut mitis et clemens, participemque eum suae maiestatis adscisceret, futurum laborum quoque socium, quos Arctoae provinciae diu fessae poscebant.</p>

<blockquote>
<p>Inter has ruinarum varietates a Nisibi quam tuebatur accitus Vrsicinus, cui nos obsecuturos iunxerat imperiale praeceptum, dispicere litis exitialis certamina cogebatur abnuens et reclamans, adulatorum oblatrantibus turmis, bellicosus sane milesque semper et militum ductor sed forensibus iurgiis longe discretus, qui metu sui discriminis anxius cum accusatores quaesitoresque subditivos sibi consociatos ex isdem foveis cerneret emergentes, quae clam palamve agitabantur, occultis Constantium litteris edocebat inplorans subsidia, quorum metu tumor notissimus Caesaris exhalaret.</p>
</blockquote>

<p>Quid enim tam absurdum quam delectari multis inanimis rebus, ut honore, ut gloria, ut aedificio, ut vestitu cultuque corporis, animante virtute praedito, eo qui vel amare vel, ut ita dicam, redamare possit, non admodum delectari? Nihil est enim remuneratione benevolentiae, nihil vicissitudine studiorum officiorumque iucundius.</p>

<h2>Ciliciam vero, quae Cydno amni exultat,</h2>

<p>Tarsus nobilitat, urbs perspicabilis hanc condidisse Perseus memoratur, Iovis filius et Danaes, vel certe ex Aethiopia profectus Sandan quidam nomine vir opulentus et nobilis et Anazarbus auctoris vocabulum referens, et Mopsuestia vatis illius domicilium Mopsi, quem a conmilitio Argonautarum cum aureo vellere direpto redirent, errore abstractum delatumque ad Africae litus mors repentina consumpsit, et ex eo cespite punico tecti manes eius heroici dolorum varietati medentur plerumque sospitales.</p>",Générateur de texte aléatoire - Lorem Ipsum,2018-10-13 14:25:00,0,NULL,dc55513e8acff69e0b4103df05c5e073.jpeg
5,"Nisi mihi Phaedrum, inquam, tu mentitum",Annie Tartempion,nisi-mihi-phaedrum-inquam-tu-mentitum,"<p>Dum apud Persas, ut supra narravimus, perfidia regis motus agitat insperatos, et in eois tractibus bella rediviva consurgunt, anno sexto decimo et eo diutius post Nepotiani exitium, saeviens per urbem aeternam urebat cuncta Bellona, ex primordiis minimis ad clades excita luctuosas, quas obliterasset utinam iuge silentium! ne forte paria quandoque temptentur, plus exemplis generalibus nocitura quam delictis.</p>

<p class=""embed-responsive embed-responsive-16by9""><iframe src=""//www.youtube.com/embed/_8kExcHqFi4?rel=0""></iframe></p>

<h2>Nisi mihi Phaedrum, inquam, tu mentitum</h2>

<p>aut Zenonem putas, quorum utrumque audivi, cum mihi nihil sane praeter sedulitatem probarent, omnes mihi Epicuri sententiae satis notae sunt. atque eos, quos nominavi, cum Attico nostro frequenter audivi, cum miraretur ille quidem utrumque, Phaedrum autem etiam amaret, cotidieque inter nos ea, quae audiebamus, conferebamus, neque erat umquam controversia, quid ego intellegerem, sed quid probarem.</p>

<p>Martinus agens illas provincias pro praefectis aerumnas innocentium graviter gemens saepeque obsecrans, ut ab omni culpa inmunibus parceretur, cum non inpetraret, minabatur se discessurum: ut saltem id metuens perquisitor malivolus tandem desineret quieti coalitos homines in aperta pericula proiectare.</p>

<h2>Sed quid est quod in hac causa maxime</h2>

<p>homines admirentur et reprehendant meum consilium, cum ego idem antea multa decreverim, que magis ad hominis dignitatem quam ad rei publicae necessitatem pertinerent? Supplicationem quindecim dierum decrevi sententia mea. Rei publicae satis erat tot dierum quot C. Mario ; dis immortalibus non erat exigua eadem gratulatio quae ex maximis bellis. Ergo ille cumulus dierum hominis est dignitati tributus.</p>","aut Zenonem putas, quorum utrumque audivi, cum mihi nihil sane praeter sedulitatem probarent, omnes mihi Epicuri sententiae satis notae sunt. atque eos, quos nominavi, cum Attico nostro frequenter audivi, cum miraretur ille quidem utrumque, Phaedrum autem etiam amaret, cotidieque",2018-10-13 14:27:43,0,2018-10-15 08:00:10,259f60e69c4b38428d89a10e71459f68.jpeg
6,"Quod cum ita sit, paucae domus studiorum seriis",Fanny Lefore,quod-cum-ita-sit-paucae-domus-studiorum-seriis,"<p>Quod cum ita sit, paucae domus studiorum seriis cultibus antea celebratae nunc ludibriis ignaviae torpentis exundant, vocali sonu, perflabili tinnitu fidium resultantes. denique pro philosopho cantor et in locum oratoris doctor artium ludicrarum accitur et bybliothecis sepulcrorum ritu in perpetuum clausis organa fabricantur hydraulica, et lyrae ad speciem carpentorum ingentes tibiaeque et histrionici gestus instrumenta non levia.</p>

<p>Inter has ruinarum varietates a Nisibi quam tuebatur accitus Vrsicinus, cui nos obsecuturos iunxerat imperiale praeceptum, dispicere litis exitialis certamina cogebatur abnuens et reclamans, adulatorum oblatrantibus turmis, bellicosus sane milesque semper et militum ductor sed forensibus iurgiis longe discretus, qui metu sui discriminis anxius cum accusatores quaesitoresque subditivos sibi consociatos ex isdem foveis cerneret emergentes, quae clam palamve agitabantur, occultis Constantium litteris edocebat inplorans subsidia, quorum metu tumor notissimus Caesaris exhalaret.</p>

<h2>Saepissime igitur mihi de amicitia</h2>

<p>cogitanti maxime illud considerandum videri solet, utrum propter imbecillitatem atque inopiam desiderata sit amicitia, ut dandis recipiendisque meritis quod quisque minus per se ipse posset, id acciperet ab alio vicissimque redderet, an esset hoc quidem proprium amicitiae, sed antiquior et pulchrior et magis a natura ipsa profecta alia causa. Amor enim, ex quo amicitia nominata est, princeps est ad benevolentiam coniungendam. Nam utilitates quidem etiam ab iis percipiuntur saepe qui simulatione amicitiae coluntur et observantur temporis causa, in amicitia autem nihil fictum est, nihil simulatum et, quidquid est, id est verum et voluntarium.</p>

<p>Ipsam vero urbem Byzantiorum fuisse refertissimam atque ornatissimam signis quis ignorat? Quae illi, exhausti sumptibus bellisque maximis, cum omnis Mithridaticos impetus totumque Pontum armatum affervescentem in Asiam atque erumpentem, ore repulsum et cervicibus interclusum suis sustinerent, tum, inquam, Byzantii et postea signa illa et reliqua urbis ornanemta sanctissime custodita tenuerunt.</p>

<p>Cyprum itidem insulam procul a continenti discretam et portuosam inter municipia crebra urbes duae faciunt claram Salamis et Paphus, altera Iovis delubris altera Veneris templo insignis. tanta autem tamque multiplici fertilitate abundat rerum omnium eadem Cyprus ut nullius externi indigens adminiculi indigenis viribus a fundamento ipso carinae ad supremos usque carbasos aedificet onerariam navem omnibusque armamentis instructam mari committat.</p>

<p>Inter haec Orfitus praefecti potestate regebat urbem aeternam ultra modum delatae dignitatis sese efferens insolenter, vir quidem prudens et forensium negotiorum oppido gnarus, sed splendore liberalium doctrinarum minus quam nobilem decuerat institutus, quo administrante seditiones sunt concitatae graves ob inopiam vini: huius avidis usibus vulgus intentum ad motus asperos excitatur et crebros.</p>

<p>Haec et huius modi quaedam innumerabilia ultrix facinorum impiorum bonorumque praemiatrix aliquotiens operatur Adrastia atque utinam semper quam vocabulo duplici etiam Nemesim appellamus: ius quoddam sublime numinis efficacis, humanarum mentium opinione lunari circulo superpositum, vel ut definiunt alii, substantialis tutela generali potentia partilibus praesidens fatis,<a href=""https://www.faux-texte.com/lorem-ipsum-20.htm"" target=""_blank""> quam theologi veteres fingentes </a>Iustitiae filiam ex abdita quadam aeternitate tradunt omnia despectare terrena.</p>

<h2>Et quoniam apud eos ut in capite</h2>

<p>mundi morborum acerbitates celsius dominantur, ad quos vel sedandos omnis professio medendi torpescit, excogitatum est adminiculum sospitale nequi amicum perferentem similia videat, additumque est cautionibus paucis remedium aliud satis validum, ut famulos percontatum missos quem ad modum valeant noti hac aegritudine colligati, non ante recipiant domum quam lavacro purgaverint corpus. ita etiam alienis oculis visa metuitur labes.</p>

<figure class=""easyimage easyimage-side""><img alt="""" src=""blob:http://dev.cgofficiel.fr/40b9ce2f-83da-49e6-b3fd-b13bcc1de1f5"" width=""640"" />
<figcaption></figcaption>
</figure>

<p>Mensarum enim voragines et varias voluptatum inlecebras, ne longius progrediar, praetermitto illuc transiturus quod quidam per ampla spatia urbis subversasque silices sine periculi metu properantes equos velut publicos signatis quod dicitur calceis agitant, familiarium agmina tamquam praedatorios globos post terga trahentes ne Sannione quidem, ut ait comicus, domi relicto. quos imitatae matronae complures opertis capitibus et basternis per latera civitatis cuncta discurrunt.</p>

<p>Ardeo, mihi credite, Patres conscripti (id quod vosmet de me existimatis et facitis ipsi) incredibili quodam amore patriae, qui me amor et subvenire olim impendentibus periculis maximis cum dimicatione capitis, et rursum, cum omnia tela undique esse intenta in patriam viderem, subire coegit atque excipere unum pro universis. Hic me meus in rem publicam animus pristinus ac perennis cum C. Caesare reducit, reconciliat, restituit in&nbsp;</p>","cogitanti maxime illud considerandum videri solet, utrum propter imbecillitatem atque inopiam desiderata sit amicitia, ut dandis recipiendisque meritis quod quisque minus per se ipse posset, id utilitates quidem",2018-10-15 12:32:00,0,2018-10-16 10:15:00,015def8d8855fb65c72ae7ee98da35f4.jpeg
7,Cyprum itidem insulam procul a continenti discretam,Emilie Courtois,cyprum-itidem-insulam-procul-a-continenti-discretam,"<p>Cyprum itidem insulam procul a continenti discretam et portuosam inter municipia crebra urbes duae faciunt claram Salamis et Paphus, altera Iovis delubris altera Veneris templo insignis. tanta autem tamque multiplici fertilitate abundat rerum omnium eadem Cyprus ut nullius externi indigens adminiculi indigenis viribus a fundamento ipso carinae ad supremos usque carbasos aedificet onerariam navem omnibusque armamentis instructam mari committat.</p>

<h2>Tu autem, Fanni, quod mihi tantum tribui</h2>

<p>dicis quantum ego nec adgnosco nec postulo, facis amice; sed, ut mihi videris, non recte iudicas de Catone; aut enim nemo, quod quidem magis credo, aut si quisquam, ille sapiens fuit. Quo modo, ut alia omittam, mortem filii tulit! memineram Paulum, videram Galum, sed hi in pueris, Cato in perfecto et spectato viro.</p>

<p>Latius iam disseminata licentia onerosus bonis omnibus Caesar nullum post haec adhibens modum orientis latera cuncta vexabat nec honoratis parcens nec urbium primatibus nec plebeiis.</p>

<p>Abusus enim multitudine hominum, quam tranquillis in rebus diutius rexit, ex agrestibus habitaculis urbes construxit multis opibus firmas et viribus, quarum ad praesens pleraeque licet Graecis nominibus appellentur, quae isdem ad arbitrium inposita sunt conditoris, primigenia tamen nomina non amittunt, quae eis Assyria lingua institutores veteres indiderunt.</p>

<h2>Sin autem ad adulescentiam perduxissent</h2>

<p>Dirimi tamen interdum contentione vel uxoriae condicionis vel commodi alicuius, quod idem adipisci uterque non posset. Quod si qui longius in amicitia provecti essent, tamen saepe labefactari, si in honoris contentionem incidissent; pestem enim nullam maiorem esse amicitiis quam in plerisque pecuniae cupiditatem, in optimis quibusque honoris certamen et gloriae; ex quo inimicitias maximas saepe inter amicissimos exstitisse.</p>

<p>Victus universis caro ferina est lactisque abundans copia qua sustentantur, et herbae multiplices et siquae alites capi per aucupium possint, et plerosque mos vidimus frumenti usum et vini penitus ignorantes.</p>

<p>Nisi mihi Phaedrum, inquam, tu mentitum aut Zenonem putas, quorum utrumque audivi, cum mihi nihil sane praeter sedulitatem probarent, omnes mihi Epicuri sententiae satis notae sunt. atque eos, quos nominavi, cum Attico nostro frequenter audivi, cum miraretur ille quidem utrumque, Phaedrum autem etiam amaret, cotidieque inter nos ea, quae audiebamus, conferebamus, neque erat umquam controversia, quid ego intellegerem, sed quid probarem.</p>","Cyprum itidem insulam procul a continenti discretam et portuosam inter municipia crebra urbes duae faciunt claram Salamis et Paphus, altera Iovis delubris altera Veneris templo insignis. tanta autem tamque multiplici fertilitate a",2018-10-16 09:56:16,0,2018-10-21 11:44:59,2731fec4e0573b167010008faec6fbc8.jpeg
8,Coût pour une moto,Alain,cout-pour-une-moto,"<p>Les taxes dues sont :</p>

<p>Y1 : la taxe r&eacute;gionale proportionnelle &agrave; la puissance fiscale : (nombre de chevaux fiscaux multipli&eacute; par le taux unitaire) divis&eacute;e par 2<br />
Y4 : la taxe de gestion 4&euro;<br />
Y5 : la taxe d&rsquo;acheminement 2,76&euro;<br />
Tableau des puissances fiscales des deux-roues motoris&eacute;s en fonction des centim&egrave;tres cubes<br />
Puissance fiscale&nbsp;&nbsp; &nbsp;Cylindr&eacute;e<br />
1 CV&nbsp;&nbsp; &nbsp;inf&eacute;rieure ou &eacute;gale &agrave; 125 cm3<br />
2 CV&nbsp;&nbsp; &nbsp;entre 125 cm3 et 175 cm3<br />
3 CV&nbsp;&nbsp; &nbsp;entre 175 cm3 et 250 cm3<br />
4 CV&nbsp;&nbsp; &nbsp;entre 250 cm3 et 350 cm3<br />
5 CV&nbsp;&nbsp; &nbsp;entre 350 cm3 et 500 cm3<br />
Au-dessus de 500 cm3, il convient d&rsquo;ajouter 1 CV par fraction de 125 cm3 suppl&eacute;mentaire.</p>

<figure class=""easyimage my-custom-full-class""><img alt="""" sizes=""100vw"" src=""https://35511.cdn.cke-cs.com/CyVRMWdYifzM9KCGbD28/images/e73383f698f46ebca71980c63fe1a54c58b24a5614e14b9b_téléchargement%20(9).jpg"" srcset=""https://35511.cdn.cke-cs.com/CyVRMWdYifzM9KCGbD28/images/e73383f698f46ebca71980c63fe1a54c58b24a5614e14b9b_téléchargement%20(9).jpg/w_80 80w, https://35511.cdn.cke-cs.com/CyVRMWdYifzM9KCGbD28/images/e73383f698f46ebca71980c63fe1a54c58b24a5614e14b9b_téléchargement%20(9).jpg/w_160 160w, https://35511.cdn.cke-cs.com/CyVRMWdYifzM9KCGbD28/images/e73383f698f46ebca71980c63fe1a54c58b24a5614e14b9b_téléchargement%20(9).jpg/w_240 240w, https://35511.cdn.cke-cs.com/CyVRMWdYifzM9KCGbD28/images/e73383f698f46ebca71980c63fe1a54c58b24a5614e14b9b_téléchargement%20(9).jpg/w_320 320w, https://35511.cdn.cke-cs.com/CyVRMWdYifzM9KCGbD28/images/e73383f698f46ebca71980c63fe1a54c58b24a5614e14b9b_téléchargement%20(9).jpg/w_400 400w, https://35511.cdn.cke-cs.com/CyVRMWdYifzM9KCGbD28/images/e73383f698f46ebca71980c63fe1a54c58b24a5614e14b9b_téléchargement%20(9).jpg/w_480 480w, https://35511.cdn.cke-cs.com/CyVRMWdYifzM9KCGbD28/images/e73383f698f46ebca71980c63fe1a54c58b24a5614e14b9b_téléchargement%20(9).jpg/w_560 560w, https://35511.cdn.cke-cs.com/CyVRMWdYifzM9KCGbD28/images/e73383f698f46ebca71980c63fe1a54c58b24a5614e14b9b_téléchargement%20(9).jpg/w_640 640w"" width=""640"" />
<figcaption></figcaption>
</figure>

<p>&nbsp;</p>",top affaire,2018-10-16 00:00:00,0,2018-11-05 08:31:55,7fd97b9725f0fbbdcb91b35bb4694002.jpeg
9,Apprendre à lire et calculer le prix d'un certificat d'immatriculation,Marc Tommy,apprendre-a-lire-et-calculer-le-prix-dun-certificat-dimmatriculation,"<p><strong>Pour immatriculer un v&eacute;hicule, il est n&eacute;cessaire de bien comprendre chaque rubrique du certificat d&rsquo;immatriculation.</strong></p>

<p>Le prix de votre nouvelle carte grise sera calcul&eacute; en fonction de votre&nbsp;<strong>lieu d&rsquo;habitation</strong>, du&nbsp;<strong>genre</strong>&nbsp;(case J.1 de la carte grise), de la&nbsp;<strong>puissance fiscale</strong>&nbsp;(case P.6), de l&rsquo;<strong>&eacute;nergie du moteur</strong>&nbsp;(case P.3), des &eacute;missions de&nbsp;<strong>CO2</strong>&nbsp;(case V.7) et de la&nbsp;<strong>date de la mise en circulation du v&eacute;hicule&nbsp;</strong>(case B). Cela vaut pour tous les types de v&eacute;hicule&nbsp;: automobiles, cyclomoteurs, poids lourds, voitures de collection...<br />
<br />
Tous ces &eacute;l&eacute;ments apparaissent sur l&#39;ancien certificat d&#39;immatriculation que le vendeur vous aura remis au moment de la vente. Ce certificat vous permettra de r&eacute;aliser les d&eacute;marches n&eacute;cessaires afin d&#39;obtenir une carte grise &agrave; votre nom, et cette derni&egrave;re retranscrira &eacute;videmment les m&ecirc;mes caract&eacute;ristiques. En parall&egrave;le, vous devrez&nbsp;<strong>conserver durant 5 ans cette ancienne carte grise</strong>. Elle pourrait vous &ecirc;tre demand&eacute;e par les forces de l&#39;ordre en cas de contr&ocirc;le.&nbsp;</p>

<p>CGofficiel.fr&nbsp;vous permet ci-dessous de calculer le&nbsp;<u><a href=""#"" target=""_blank"" title=""Obtenez le prix de votre certificat d'immatriculation en moins d'une minute"">co&ucirc;t de votre carte grise</a></u>&nbsp;et vous d&eacute;crypte &eacute;galement l&#39;ensemble des &eacute;l&eacute;ments afin de lire et mieux comprendre les informations de votre certificat d&rsquo;immatriculation. Cette page concerne uniquement le nouveau syst&egrave;me (SIV &ndash; syst&egrave;me d&rsquo;immatriculation des v&eacute;hicules). L&rsquo;ancienne carte grise (format FNI) n&rsquo;est pas d&eacute;velopp&eacute;e ici. Pour conna&icirc;tre en quelques secondes le&nbsp;<strong>co&ucirc;t de votre carte grise</strong>, quel que soit votre v&eacute;hicule ou votre lieu d&#39;habitation, utilisez notre simulateur de taxe ci-apr&egrave;s. Vous pourrez ensuite faire une demande de carte grise en ligne sur notre site Internet.</p>","On retrouve le numéro d’immatriculation qui est ""attribué à vie"" au véhicule sous le format AB-123-CD. C'est ce numéro que l’on retrouve sur les plaques d'immatriculation du véhicule.",2018-10-22 13:59:00,0,NULL,cae6be45cf1f68162ac5c9ac86671ae1.jpeg
